{
  "schema_version": "1.0.0",
  "record_type": "parallel_batch_run",
  "id": "parallel-batch-001-candidate-review-20260628t170018z",
  "batch_plan_id": "parallel-batch-plan-v1",
  "batch_plan_path": "ops/codex-batches/parallel-batch-plan.v1.json",
  "batch_id": "parallel-batch-001-candidate-review",
  "batch_sequence": 1,
  "parallel_group": "candidate-review",
  "execution_class": "independent",
  "reconciliation_required": false,
  "started_at": "2026-06-28T17:00:18.118Z",
  "status": "succeeded",
  "log_path": "ops/codex-batches/logs/parallel-batch-001-candidate-review-20260628t170018z.jsonl",
  "worker_states": [
    {
      "job_id": "self-healing-candidate-review-extraction-debt-dq-bone-adverse-events-20wk-mixed-repair-extraction-fidelity",
      "job_path": "ops/codex-jobs/live/generated-self-healing/self-healing-candidate-review-extraction-debt-dq-bone-adverse-events-20wk-mixed-repair-extraction-fidelity.json",
      "command": [
        "npm",
        "run",
        "agent:codex:worktree",
        "--",
        "--job-file",
        "ops/codex-jobs/live/generated-self-healing/self-healing-candidate-review-extraction-debt-dq-bone-adverse-events-20wk-mixed-repair-extraction-fidelity.json",
        "--execute",
        "--allow-dirty"
      ],
      "status": "succeeded",
      "started_at": "2026-06-28T17:00:18.119Z",
      "worktree_path": "/tmp/lhr-codex-worktrees/self-healing-candidate-review-extraction-debt-dq-bone-adverse-events-20wk-mixed-repair-extraction-fidelity-20260628T170018z",
      "completed_at": "2026-06-28T17:04:59.303Z",
      "exit_code": 0,
      "output_path": "research/agent-runs/self-healing-candidate-review-extraction-debt-dq-bone-adverse-events-20wk-mixed-repair-extraction-fidelity.json",
      "worker_log_path": "research/agent-runs/logs/self-healing-candidate-review-extraction-debt-dq-bone-adverse-events-20wk-mixed-repair-extraction-fidelity.jsonl",
      "archive_path": "ops/codex-jobs/archive/self-healing-candidate-review-extraction-debt-dq-bone-adverse-events-20wk-mixed-repair-extraction-fidelity.json"
    },
    {
      "job_id": "self-healing-candidate-review-extraction-debt-dq-bone-adverse-events-20wk-mixed-repair-safety-limitations",
      "job_path": "ops/codex-jobs/live/generated-self-healing/self-healing-candidate-review-extraction-debt-dq-bone-adverse-events-20wk-mixed-repair-safety-limitations.json",
      "command": [
        "npm",
        "run",
        "agent:codex:worktree",
        "--",
        "--job-file",
        "ops/codex-jobs/live/generated-self-healing/self-healing-candidate-review-extraction-debt-dq-bone-adverse-events-20wk-mixed-repair-safety-limitations.json",
        "--execute",
        "--allow-dirty"
      ],
      "status": "succeeded",
      "started_at": "2026-06-28T17:00:18.120Z",
      "worktree_path": "/tmp/lhr-codex-worktrees/self-healing-candidate-review-extraction-debt-dq-bone-adverse-events-20wk-mixed-repair-safety-limitations-20260628T170018z",
      "completed_at": "2026-06-28T17:03:56.565Z",
      "exit_code": 0,
      "output_path": "research/agent-runs/self-healing-candidate-review-extraction-debt-dq-bone-adverse-events-20wk-mixed-repair-safety-limitations.json",
      "worker_log_path": "research/agent-runs/logs/self-healing-candidate-review-extraction-debt-dq-bone-adverse-events-20wk-mixed-repair-safety-limitations.jsonl",
      "archive_path": "ops/codex-jobs/archive/self-healing-candidate-review-extraction-debt-dq-bone-adverse-events-20wk-mixed-repair-safety-limitations.json"
    },
    {
      "job_id": "self-healing-candidate-review-extraction-debt-dq-bone-adverse-events-20wk-mixed-repair-synthesis-boundary",
      "job_path": "ops/codex-jobs/live/generated-self-healing/self-healing-candidate-review-extraction-debt-dq-bone-adverse-events-20wk-mixed-repair-synthesis-boundary.json",
      "command": [
        "npm",
        "run",
        "agent:codex:worktree",
        "--",
        "--job-file",
        "ops/codex-jobs/live/generated-self-healing/self-healing-candidate-review-extraction-debt-dq-bone-adverse-events-20wk-mixed-repair-synthesis-boundary.json",
        "--execute",
        "--allow-dirty"
      ],
      "status": "succeeded",
      "started_at": "2026-06-28T17:00:18.120Z",
      "worktree_path": "/tmp/lhr-codex-worktrees/self-healing-candidate-review-extraction-debt-dq-bone-adverse-events-20wk-mixed-repair-synthesis-boundary-20260628T170018z",
      "completed_at": "2026-06-28T17:05:32.806Z",
      "exit_code": 0,
      "output_path": "research/agent-runs/self-healing-candidate-review-extraction-debt-dq-bone-adverse-events-20wk-mixed-repair-synthesis-boundary.json",
      "worker_log_path": "research/agent-runs/logs/self-healing-candidate-review-extraction-debt-dq-bone-adverse-events-20wk-mixed-repair-synthesis-boundary.jsonl",
      "archive_path": "ops/codex-jobs/archive/self-healing-candidate-review-extraction-debt-dq-bone-adverse-events-20wk-mixed-repair-synthesis-boundary.json"
    },
    {
      "job_id": "self-healing-candidate-review-extraction-debt-dq-bone-adverse-events-20wk-mixed-repair-taxonomy-mapping",
      "job_path": "ops/codex-jobs/live/generated-self-healing/self-healing-candidate-review-extraction-debt-dq-bone-adverse-events-20wk-mixed-repair-taxonomy-mapping.json",
      "command": [
        "npm",
        "run",
        "agent:codex:worktree",
        "--",
        "--job-file",
        "ops/codex-jobs/live/generated-self-healing/self-healing-candidate-review-extraction-debt-dq-bone-adverse-events-20wk-mixed-repair-taxonomy-mapping.json",
        "--execute",
        "--allow-dirty"
      ],
      "status": "succeeded",
      "started_at": "2026-06-28T17:00:18.120Z",
      "worktree_path": "/tmp/lhr-codex-worktrees/self-healing-candidate-review-extraction-debt-dq-bone-adverse-events-20wk-mixed-repair-taxonomy-mapping-20260628T170018z",
      "completed_at": "2026-06-28T17:04:43.169Z",
      "exit_code": 0,
      "output_path": "research/agent-runs/self-healing-candidate-review-extraction-debt-dq-bone-adverse-events-20wk-mixed-repair-taxonomy-mapping.json",
      "worker_log_path": "research/agent-runs/logs/self-healing-candidate-review-extraction-debt-dq-bone-adverse-events-20wk-mixed-repair-taxonomy-mapping.jsonl",
      "archive_path": "ops/codex-jobs/archive/self-healing-candidate-review-extraction-debt-dq-bone-adverse-events-20wk-mixed-repair-taxonomy-mapping.json"
    }
  ],
  "summary": {
    "planned_count": 0,
    "running_count": 0,
    "succeeded_count": 4,
    "pending_reconciliation_count": 0,
    "failed_count": 0,
    "archived_count": 4
  },
  "next_actions": [
    "Run npm run verify:knowledge-base after reviewing resulting candidate changes."
  ],
  "completed_at": "2026-06-28T17:05:32.807Z"
}
